<?xml version="1.0" encoding="utf-8"?>
<xs:schema xmlns:xs="http://www.w3.org/2001/XMLSchema">
  <xs:element name="Datatable" />
  <xs:element name="SystemSupervisorDefinition" nillable="true" type="SystemSupervisorDefinition" />
  <xs:complexType name="SystemSupervisorDefinition">
    <xs:complexContent mixed="false">
      <xs:extension base="DatatableElement">
        <xs:sequence>
          <xs:element minOccurs="0" maxOccurs="1" name="Policy" type="SystemAutomatonPolicy" />
          <xs:element minOccurs="0" maxOccurs="1" name="Gains" type="ArrayOfSupervisorGain" />
          <xs:choice minOccurs="0" maxOccurs="unbounded">
            <xs:element minOccurs="0" maxOccurs="1" name="DatePrerequisite" type="DatePrerequisite" />
            <xs:element minOccurs="0" maxOccurs="1" name="GameSettingPrerequisite" type="GameSettingPrerequisite" />
            <xs:element minOccurs="0" maxOccurs="1" name="DownloadableContentPrerequisite" type="DownloadableContentPrerequisite" />
            <xs:element minOccurs="0" maxOccurs="1" name="SupportPrerequisite" type="SupportPrerequisite" />
            <xs:element minOccurs="0" maxOccurs="1" name="TechnologyPrerequisite" type="TechnologyPrerequisite" />
            <xs:element minOccurs="0" maxOccurs="1" name="InterpreterPrerequisite" type="InterpreterPrerequisite" />
            <xs:element minOccurs="0" maxOccurs="1" name="PathPrerequisite" type="PathPrerequisite" />
          </xs:choice>
        </xs:sequence>
      </xs:extension>
    </xs:complexContent>
  </xs:complexType>
  <xs:complexType name="SystemAutomatonPolicy">
    <xs:attribute name="CanQueueConstructions" type="xs:boolean" use="required" />
    <xs:attribute name="CanMovePopulations" type="xs:boolean" use="required" />
  </xs:complexType>
  <xs:complexType name="ArrayOfSupervisorGain">
    <xs:sequence>
      <xs:element minOccurs="0" maxOccurs="unbounded" name="Gain" type="SupervisorGain" />
    </xs:sequence>
  </xs:complexType>
  <xs:complexType name="SupervisorGain">
    <xs:sequence>
      <xs:element minOccurs="0" maxOccurs="1" name="Tags" type="Tags" />
    </xs:sequence>
    <xs:attribute name="Name" type="xs:string" />
    <xs:attribute default="1" name="Weight" type="xs:float" />
  </xs:complexType>
  <xs:complexType name="Tags">
    <xs:simpleContent>
      <xs:extension base="xs:string" />
    </xs:simpleContent>
  </xs:complexType>
  <xs:complexType name="DatePrerequisite">
    <xs:simpleContent>
      <xs:extension base="Prerequisite" />
    </xs:simpleContent>
  </xs:complexType>
  <xs:complexType name="Prerequisite">
    <xs:simpleContent>
      <xs:extension base="xs:string">
        <xs:attribute default="false" name="Inverted" type="xs:boolean" />
        <xs:attribute name="Flags" type="xs:string" />
      </xs:extension>
    </xs:simpleContent>
  </xs:complexType>
  <xs:complexType name="GameSettingPrerequisite">
    <xs:simpleContent>
      <xs:extension base="Prerequisite" />
    </xs:simpleContent>
  </xs:complexType>
  <xs:complexType name="DownloadableContentPrerequisite">
    <xs:simpleContent>
      <xs:extension base="Prerequisite" />
    </xs:simpleContent>
  </xs:complexType>
  <xs:complexType name="SupportPrerequisite">
    <xs:simpleContent>
      <xs:extension base="Prerequisite">
        <xs:attribute name="Politics" type="xs:string" />
      </xs:extension>
    </xs:simpleContent>
  </xs:complexType>
  <xs:complexType name="PathValidityPrerequisite">
    <xs:simpleContent>
      <xs:extension base="Prerequisite" />
    </xs:simpleContent>
  </xs:complexType>
  <xs:complexType name="TechnologyPrerequisite">
    <xs:simpleContent>
      <xs:extension base="PathValidityPrerequisite">
        <xs:attribute default="false" name="UnlockHidden" type="xs:boolean" />
      </xs:extension>
    </xs:simpleContent>
  </xs:complexType>
  <xs:complexType name="InterpreterPrerequisite">
    <xs:simpleContent>
      <xs:extension base="Prerequisite" />
    </xs:simpleContent>
  </xs:complexType>
  <xs:complexType name="PathPrerequisite">
    <xs:simpleContent>
      <xs:extension base="Prerequisite" />
    </xs:simpleContent>
  </xs:complexType>
  <xs:complexType name="DatatableElement">
    <xs:attribute name="Name" type="xs:string" />
  </xs:complexType>
</xs:schema>